unqProductCategoryId,unqProductId,vchSegmentCode,vchSegmentDescription,vchFamilyCode,vchFamilyDescription,vchClassCode,vchClassDescription,intBrickCode,"vchBrickDescription""",vchProductName,bitConsumerUnit,datModified,datPublished,vchTargetMarket,vchReferenceId,vchBrandName,unqProductClaimId,bitGlutenFree,bitKosher,bitMsgFree,unqProductDescriptionId,vchProductDescription,vchAdditionalDescription,vchShortDescription,vchServingSuggestions,vchPreparation,vchStorage,intShelfLifeDays,unqProductImageId,vchFileName,vchOriginalUrl,vchLocalPath,unqProductIngredientId,vchIngredientStatement
93532420-F371-4E16-B5BA-BD79F2FDA327,CE301D17-4957-4C53-9416-A008496F4458,50000000,Food/Beverage/Tobacco,50170000,Seasonings/Preservatives/Extracts,50171500,Herbs/Spices/Extracts,10000049,Herbs/Spices (Shelf Stable),"DURKEE, TACO SEASONING, SALT-FREE, .9 OZ",1,2016-09-14 13:59:07,2016-09-14 14:12:37,US,P1ksD1,DURKEE,A1D85758-CAB2-4DDB-80B1-57E0201AF7FB,,1.0,,E71DF147-0AD3-43FC-9679-1C9E0C4AD36A,"Enjoy the flavor of traditional taco seasoning without the salt! Durkee Salt Free Taco Seasoning is gluten free and contains no added MSG. The blend is a finely ground, reddish powder. The flavor has hints of cumin, oregano and chile peppers with a moderate heat level.","Enjoy the flavor of traditional taco seasoning without the salt!  Durkee Salt Free Taco Seasoning is gluten free and contains no added MSG.  The blend is a finely ground, reddish powder.  The flavor has hints of cumin, oregano and chile peppers with a moderate heat level.",TACO SEASONING,"Great as a salt-free alternative in any recipe calling for taco seasoning! Use in any Mexican entrée or appetizer: tacos, enchiladas, burritos, dips, taco salads or nachos. Use with ground beef, chicken, turkey or pork. This product can also be added to chili for added flavor.","Brown 10 lbs of Ground Beef.  Sprinkle contencts of package over meat.  Stir in 1 qt of water.  Simmer 20 minutes, stirring occasionally.","For best results, store tightly closed in a cool dry place.",730,B6B7C0B4-92C4-479E-8BDC-6D46D34B11A2,Taco Seasoning Salt Free.00047600005103.jpg,https://dam.catalog.1worldsync.com/im/dwn/1WS-663521,/images/ProductImages/b6b7c0b4-92c4-479e-8bdc-6d46d34b11a2.jpg,75DBC14E-4F87-4BD0-BD6A-FA99FB6FA908,"Chili Pepper, Spices, Dehydrated Onion, Dehydrated Garlic, Corn Flour,Sugar, Paprika, Tomato Powder, Autolyzed Yeast Extract, Corn Starch, RedPepper, Paprika Extractives (color), Natural Flavor."
03AFB734-8412-431D-BCD5-BDF1B6AC547E,C4A70D98-91E7-4DAA-97A8-92808C939852,50000000,Food/Beverage/Tobacco,50170000,Seasonings/Preservatives/Extracts,50171500,Herbs/Spices/Extracts,10000049,Herbs/Spices (Shelf Stable),"DURKEE, SWEET HEAT BLEND, 28OZ",1,2016-09-14 13:36:26,2016-09-14 14:12:37,US,fr6HOG,DURKEE,C13CAA26-291D-49F5-B21E-14AE5AE2F83F,1.0,1.0,,EB5C1B01-F0FC-4DFD-9601-A1AFE78CAA01,Adding flavor to your dishes will increase consumption as well as ensure the maximum satisfaction from your customers.,Adding flavor to your dishes will increase consumption as well as ensure the maximum satisfaction from your customers.,SWEET HEAT BLEND,"Use Durkee Sweet Heat Blend on just about any food that is deep fried. It is a natural on all kinds of French fries, sweet potato fries or onion rings. Or add to best selling appetizers like chicken wings, deep fried mushrooms, sweet pepper strips, crab Rangoon, egg rolls, toasted ravioli, cheese sticks or calamari. Don’t forget the entrees like chicken strips, fish sticks, clam strips, coconut shrimp or chicken sliders. Make your own potato chips, tortilla chips or pita wedges and season with Durkee Sweet Heat Blend. Served with a creamy Queso or Spinach Dip, you’ll set new sales numbers.",Deep fry favorite appetizers or entrees until cooked through and well browned. Drain and transfer to holding pan or serving dish. Immediately sprinkle with Durkee Sweat Heat Blend.,"This product is packaged in a clear recyclable bottle with a tamper proof seal. For best results, store tightly closed in a cool dry place.",730,D7B42513-2528-4994-9A4E-F01B4692D89F,00047600951608_A_1_C_1B_MFG%232009067.jpg,https://dam.catalog.1worldsync.com/im/dwn/1WS-641665,/images/ProductImages/d7b42513-2528-4994-9a4e-f01b4692d89f.jpg,773A23A3-18B9-4E87-9BEC-2E9226DA75BF,"Sugar, Salt, Maltodextrin, Red Pepper, Chili Pepper  and  other Spices,  Honey Solids, Dehydrated Garlic and Onion, Calcium Stearate(anticaking agent), Spice Extractives, Natural Flavor, Caramel Color, and less than 2% Silicon Dioxide to prevent caking."
5495714F-DB6B-4437-8913-BE143AB8788D,BEBB7A9C-1E23-4C58-8A56-DEB2F193A553,50000000,Food/Beverage/Tobacco,50170000,Seasonings/Preservatives/Extracts,50171500,Herbs/Spices/Extracts,10000049,Herbs/Spices (Shelf Stable),"DURKEE, BLACK PEPPER, COARSE GRIND, 16OZ",1,2016-09-14 11:41:24,2016-09-14 12:12:28,US,zYNKq6,DURKEE,1D595A5A-948E-4423-A680-B1CC073111E0,1.0,1.0,,9E5C82AF-558E-4828-B4F9-C5675DDBD74C,"Durkee Coarse Ground Black Pepper does not present a dusty appearance. It is visually appealing and the uniformity of the grind provides consistent quality to the end-user. Durkee Spices offer:  Clear packaging designed for easy and efficient use, with convenient slip-guard side grips and a shake/pour cap. Easy-to-read, full bilingual labels (English and Spanish). Complete nutritional panels on every product. Unique tamper evident packaging preserves flavor and keeps spices as fresh as the day they were packaged. Versatility and variety - from core spices and seasonings to value added blends.",Durkee Coarse Ground Black Pepper does not present a dusty appearance. It is visually appealing and the uniformity of the grind provides consistent quality to the end-user.,BLACK PEPPER,"Good for peppercorn sauces & dressings, pasta salads, soups and stews. Adds bite when sprinkled on green salads.  Use for steak diane, as a rub for beef or pork roasts or to create a peppercorn marinade.",Add to food where well-dispersed pepper flavor and visual appearance is desired.  Add to food during cooking or sprinkle on after cooking.  Use a dash to 1/8 teaspoon per serving.,"This product is packaged in a clear recyclable bottle with a tamper proof seal. For best results, store tightly closed in a cool dry place.",730,0DC7EB2D-F85F-4908-8D0E-A503BE5346E5,00047600546804_A_1_C_1B_MFG%232004005.jpg,https://dam.catalog.1worldsync.com/im/dwn/1WS-641491,/images/ProductImages/0dc7eb2d-f85f-4908-8d0e-a503be5346e5.jpg,FBB3C675-8FE3-49C8-BA86-D0FD504C9DB3,Black Pepper
82D6C129-AE27-4B1C-B7D1-BFABD78B7E11,A3C7E531-EC00-4DA5-ACE7-E2E97E4D635B,50000000,Food/Beverage/Tobacco,50170000,Seasonings/Preservatives/Extracts,50171500,Herbs/Spices/Extracts,10000050,Extracts/Salt/Meat Tenderisers (Shelf Stable),"DURKEE, PURE EXTRACT, ORANGE, 16FO",1,2016-03-28 16:35:29,2016-11-08 17:12:14,US,ZnDwoY,DURKEE,82D14B06-CE2B-4F8A-AEEF-A758708ED5B6,,,,4E5BE2F1-559F-4138-8708-553DD7FF7F67,"A small amount of Durkee Pure Orange Extract provides a great deal of flavor. Therefore, you can add flavor to your food products without adding volume or changing the food's consistency. Durkee Extracts offer:   Clear packaging designed for easy and efficient use, with a convenient pour spout cap   Easy-to-read, full bilingual labels (English and Spanish)   Tamper evident foil-lined inner seal   Versatility and variety - in sizes and flavors","A small amount of Durkee Pure Orange Extract provides a great deal of flavor. Therefore, you can add flavor to your food products without adding volume or changing the food's consistency. Durkee Extracts offer:   Clear packaging designed for easy and effic",PURE EXTRACT,"Use in cakes, cookies, candy, mints, puddings, sauces, ice creams, muffins, quick breads, icings and frostings and other desserts. Add a drop to fruit smoothies or coffee drinks.","Use 3/4 to 1 teaspoon for 12 servings. Adding Pure Orange Extract to hot liquids can dissipate its flavor. For best results, stir the extract into food products after cooking.","Packaged in clear recyclable bottles with tamper proof seals.. For best results, store tightly closed in a cool dry place.",730,025E87DD-1637-4143-8E81-9FE55FB179A1,00047600344974_A_1_C_1B_MFG%232003901.jpg,https://dam.catalog.1worldsync.com/im/dwn/1WS-641403,/images/ProductImages/025e87dd-1637-4143-8e81-9fe55fb179a1.jpg,43BFE133-3776-4757-9035-C0457C3F1B8E,"Alcohol, Water and Orange Oil.  Flammability Statement - Do Not Use Near Open Flame"
8B8B7FCE-E771-479B-B5F7-C0A2BE39F2B3,D7FBFED4-E51B-44DE-A7E4-66BF4AF4B331,50000000,Food/Beverage/Tobacco,50170000,Seasonings/Preservatives/Extracts,50171500,Herbs/Spices/Extracts,10000049,Herbs/Spices (Shelf Stable),"DURKEE, WHITE PEPPER, WHOLE, 21OZ",1,2016-09-14 11:41:25,2016-09-14 12:12:28,US,1q2ZUx,DURKEE,C62F07CB-C82A-42CD-982F-6192769844CB,1.0,1.0,,8694F2FA-CB3D-460B-A0BF-3656A82FE79D,"Use where the visual appearance of black pepper would be objectionable.        Durkee Spices offer:        +  Clear packaging designed for easy and efficient use, with convenient       slip-guard side grips and a shake/pour cap        +  Easy-to-read, full bilingual labels (English and Spanish)        +  Complete nutritional panels on every product        +  Unique tamper evident packaging preserves flavor and keeps spices as fresh as the day they were packaged          +  Versatility and variety - from core spices and seasonings to value added    blends",Use where the visual appearance of black pepper would be objectionable.,WHITE PEPPER,"Grind Durkee Whole White Pepper and add to white sauces, sausage gravy, fettuccini alfredo, dips, cream soups, egg dishes or any other light colored foods. Perfect for mayonnaise blends, egg noodles, rice or mashed potatoes.  Add whole peppercorns to soups, stocks or stews.  Coarsely grind Durkee Whole White Pepper and use as a meat rub for steaks, chops or roasts.","Use in a pepper grinder and grind over light colored foods.  Or add whole peppercorns to soups or stocks.  Because of its white pepper's distinctive aroma, it is best NOT used at the table.","This product is packaged in a clear recyclable bottle with a tamper proof seal. For best results, store tightly closed in a cool dry place.",1095,CBBA8ABF-11DC-4DAD-AB08-90CF8AF90FCA,00047600547054_A_1_C_1B_MFG%232004008.jpg,https://dam.catalog.1worldsync.com/im/dwn/1WS-641496,/images/ProductImages/cbba8abf-11dc-4dad-ab08-90cf8af90fca.jpg,7AA9E82D-9376-443E-8C18-2B9A8DC54674,White Pepper
50138E51-2076-4678-AA9F-C22396D2D68D,718AD0BD-83F9-4CB5-A872-A7AFDEC893BD,50000000,Food/Beverage/Tobacco,50190000,Prepared/Preserved Foods,50192300,Desserts/Dessert Sauces/Toppings,10000195,Dessert Sauces/Toppings/Fillings (Shelf Stable),"DURKEE, FOOD COLORING, GREEN, 16FO",1,2016-03-28 16:38:49,2016-11-08 17:12:13,US,P0xX33,DURKEE,F3A6BEF6-D0E4-4642-B5A6-0D84AD29A16D,,,,9A099B38-9A14-4B31-9357-584991BEDDB9,"Durkee Green Food Color provides an easy and convenient way to add shades of green to foods.        Durkee Extracts and Food Colors offer:        +  Clear packaging designed for easy and efficient use, with a convenient pour spout cap        +  Easy-to-read, full bilingual labels (English and Spanish)        +  Tamper evident foil-lined inner seal         +  Versatility and variety - in sizes and flavors",Durkee Green Food Color provides an easy and convenient way to add shades of green to foods.,FOOD COLORING,"Use in icings and frostings, ice cream, cakes, candy, mints and other desserts for a soft green color. Add a drop to mint or lime desserts or sauces for a more inviting color.","Use a drop or two per 8 servings.  Be sure to add gradually until desired color is obtained.  The more used, the darker the color.","Packaged in clear recyclable bottles with tamper proof seals.. For best results, store tightly closed in a cool dry place.",730,A195DA27-11A6-47CA-964B-85249A6BE066,00047600344738_A_1_C_1B_MFG%232003891.jpg,https://dam.catalog.1worldsync.com/im/dwn/1WS-641394,/images/ProductImages/a195da27-11a6-47ca-964b-85249a6be066.jpg,ABF7B990-0E60-4B48-A2D8-FA297BAE4B34,"Water, Yellow 5 and 6, Blue 1, Citric Acid and Sodium Benzoate (preservative)."
A4CEE337-2C96-4569-99A2-C233F25F01A8,7446A61F-1CCD-4F3C-B6DD-A6D23068464A,50000000,Food/Beverage/Tobacco,50170000,Seasonings/Preservatives/Extracts,50171500,Herbs/Spices/Extracts,10000050,Extracts/Salt/Meat Tenderisers (Shelf Stable),"DURKEE, IMITATION FLAVOR, PEPPERMINT, 16FO",1,2016-03-28 16:35:29,2016-11-08 17:12:14,US,CiH4jx,DURKEE,ED00A024-730B-4893-83B8-BFC2A2427A1E,,,,A84A1E3F-3533-4CEF-B221-0BDD5B3ED52C,"Durkee Imitation Peppermint Flavor offers high quality and a consistent flavor profile. Durkee Extracts offer:   Clear packaging designed for easy and efficient use, with a convenient pour spout cap   Easy-to-read, full bilingual labels (English and Spanish)   Tamper evident foil-lined inner seal   Versatility and variety - in sizes and flavors","Durkee Imitation Peppermint Flavor offers high quality and a consistent flavor profile. Durkee Extracts offer:   Clear packaging designed for easy and efficient use, with a convenient pour spout cap   Easy-to-read, full bilingual labels (English and Spanis",IMITATION FLAVOR,"Use in cakes, cookies, candy, puddings, sauces, ice creams, muffins, quick breads, icing & frostings and other desserts. Especially delicious with chocolate. Add a drop of Durkee Imitation Peppermint Flavor to hot chocolate or coffee.","Add a small amount to taste for sauces or desserts. Add flavor gradually as Durkee Imitation Peppermint Flavor has an intense ""pepperminty"" flavor.","Packaged in clear recyclable bottles with tamper proof seals.. For best results, store tightly closed in a cool dry place.",730,8FB8774A-C920-4673-A1B5-51DCD796F2E7,00047600344981_A_1_C_1B_MFG%232003902.jpg,https://dam.catalog.1worldsync.com/im/dwn/1WS-641405,/images/ProductImages/8fb8774a-c920-4673-a1b5-51dcd796f2e7.jpg,EDDB7BB4-2BB7-493B-9351-7E36D5ECC601,"Alcohol, Water, Natural and Artificial Flavors, Propylene Glycol.  Flammability Statement - Do Not Use Near Open Flame"
6B53710D-6CBC-47F1-A1B6-C2D9CCDDFE1F,A1799D87-8232-49AE-9327-AA0EEBEE7784,50000000,Food/Beverage/Tobacco,50170000,Seasonings/Preservatives/Extracts,50171500,Herbs/Spices/Extracts,10000049,Herbs/Spices (Shelf Stable),"DURKEE, SWEET BBQ, NO MSG, 25LB",1,2016-09-14 12:16:46,2016-09-14 13:12:56,US,ZXwEx4,DURKEE,B06F465D-F9B1-4C33-8DB7-2C6E423121D5,1.0,1.0,,AE0EEFB0-F841-46FF-94BB-A26DC3810842,"Durkee Sweet Barbecue Seasoning offers a low cost way to make barbecue sauce or add barbecue flavor to your foods.  It's convenient to use because there's no need to stock all the spices required to get that off-the-grill-flavor.  Al you need is one bottle that's already blended for you.        Durkee Spices offer:        +  Clear packaging designed for easy and efficient use, with convenient    slip-guard side grips and a shake/pour cap        +  Easy-to-read, full bilingual labels (English and Spanish)        +  Complete nutritional panels on every product        +  Unique tamper evident packaging preserves flavor and keeps spices as fresh as the day they were packaged        +  Versatility and variety - from core spices and seasonings to value added    blends",Durkee Sweet Barbecue Seasoning offers a low cost way to make barbecue sauce or add barbecue flavor to your foods.  It's convenient to use because there's no need to stock all the spices required to get that off-the-grill-flavor.,SWEET BBQ,"Use in BBQ sauce by mixing with tomato sauce, vinegar and sugar.  Use as a rub for spareribs, pork roasts, chops, chicken or salmon.  Sprinkle on hamburgers, chicken breasts or steaks.  Delicious in baked beans, grilled vegetables or even sprinkled on popcorn.",Use as a rub for any grilled or barbecue meat or add a bit of barbecue flavor to favorite dishes.,"This product is packaged in corrugate box with plastic liner. For best results, store tightly closed in a cool, dry place.",720,51822D99-78AB-4585-8131-F611F060EB9B,00047600591873_A_1_C_1B_MFG%232004162.jpg,https://dam.catalog.1worldsync.com/im/dwn/1WS-641614,/images/ProductImages/51822d99-78ab-4585-8131-f611f060eb9b.jpg,76084673-6459-4ABC-97E7-0709372D2AC7,"Sugar, Chili Pepper and other Spices, Paprika (as color), Salt,Dehydrated Onion, Red Pepper, Dehydrated Garlic, less than 2% SiliconDioxide to prevent caking."
FFE56E5E-5B99-4FFB-8F90-C2E897D0E765,F912E54A-AED6-44AD-83C2-C1DE5C3F1AEB,50000000,Food/Beverage/Tobacco,50170000,Seasonings/Preservatives/Extracts,50171500,Herbs/Spices/Extracts,10000049,Herbs/Spices (Shelf Stable),"DURKEE, CINNAMON, GROUND, 5LB",1,2016-09-14 11:55:05,2016-09-14 12:12:29,US,y9a4SR,DURKEE,C640356F-D287-4716-BEA1-3D7B5F223A1E,1.0,1.0,,41E91D20-3D07-46F3-9DC7-5ECC9B010003,"Due to its unique process of cool-head milling which ensures all the flavor that can be is kept within the product, Durkee Ground Cinnamon offers the end user a consistent and stronger flavor than most other ground cinnamon products.        Durkee Spices offer:        +  Clear packaging designed for easy and efficient use, with convenient       slip-guard side grips and a shake/pour cap        +  Easy-to-read, full bilingual labels (English and Spanish)        +  Complete nutritional panels on every product        +  Unique tamper evident packaging preserves flavor and keeps spices as fresh as the day they were packaged          +  Versatility and variety - from core spices and seasonings to value added    blends        +  The essence of each ground spice - the volatile oil - is captured and       preserved during the Cool Head Milling process at temperatures as low as    -150F","Due to its unique process of cool-head milling which ensures all the flavor that can be is kept within the product, Durkee Ground Cinnamon offers the end user a consistent and stronger flavor than most other ground cinnamon products.",CINNAMON,"Tastes good in cakes, puddings, cookies, custards, breads and fruit. Mix with sugar and use for topical applications to coffee cakes, muffins or cinnamon toast. Can also be used in small quantities in meats, seafood or ethnic main dishes. Try sprinkling on hot beverages like cocoa & cappuccino.","The primary use for this product is in baking applications.  A pinch of ground cinnamon will add an interesting flavor to many sweet foods, as well as meat stews, dried fruits and winter squash.  Always delicious in breads, apple desserts and sweet potatoes.  Try in meat rubs for poultry.","This product is packaged in a clear recyclable bottle with a tamper proof seal. For best results, store tightly closed in a cool dry place.",730,F377668A-7EA0-4696-B986-01DD53D096D5,00047600552102_A_1_C_1B_MFG%232004049.jpg,https://dam.catalog.1worldsync.com/im/dwn/1WS-641529,/images/ProductImages/f377668a-7ea0-4696-b986-01dd53d096d5.jpg,14FBFF60-AB86-4E84-9FC0-99761CDE25E1,Cinnamon
A3B3A2C6-1107-43BD-93E7-C300A2F9F91F,9DC5A3A6-085F-4866-A91E-107115998847,50000000,Food/Beverage/Tobacco,50170000,Seasonings/Preservatives/Extracts,50171500,Herbs/Spices/Extracts,10000049,Herbs/Spices (Shelf Stable),"DURKEE, BAY LEAF, GROUND, 25LB",1,2016-09-14 12:43:32,2016-09-14 13:12:55,US,3VXa0p,DURKEE,E375FBEF-7557-4ACF-B5AB-09F97ABF63F0,1.0,1.0,,101C17AC-BE11-413F-9FC7-E8E18A3D8F06,"Durkee Ground Bay Leaves use only imported bay leaves from Turkey. Many competitors use domestic leaves. You will find that the imported leaves have a much smoother flavor and are more complementary to food products, while domestic leaves are more bitter and have a strong menthol flavor. Durkee Spices offer:  Clear packaging designed for easy and efficient use, with convenient slip-guard side grips and a shake/pour cap. Easy-to-read, full bilingual labels (English and Spanish). Complete nutritional panels on every product. Unique tamper evident packaging preserves flavor and keeps spices as fresh as the day they were packaged. Versatility and variety - from core spices and seasonings to value added blends.",,BAY LEAF,"Add to meat and vegetable stews, casseroles, pot roast, vegetables, beans, ham, curry stews, fish chowders, BBQ ribs, meat and fish sauces and pasta sauces.  Add to soups, sauces or chutneys.","Start by using 1/4 teaspoon for 4 servings, taste and adjust seasoning. Durkee Ground Bay Leaves is best added to long cooking dishes. Durkee Ground Bay Leaves are great to use when it is not practical to use (and remove) whole bay leaves.","This product is packaged in a clear recyclable bottle with a tamper proof seal. For best results, store tightly closed in a cool dry place.",730,C4F6E7FC-1C5E-4378-BF4E-7F02688927B1,GENERIC BOX.JPG,https://dam.catalog.1worldsync.com/im/dwn/1WS-743558,/images/ProductImages/c4f6e7fc-1c5e-4378-bf4e-7f02688927b1.JPG,AD44B3D0-B829-4200-B365-7653378073B8,Bay Leaves
148B0DD6-8BB7-414A-B924-C351CA54D334,A0952F32-A630-400C-AC87-668B3B4FCD2C,50000000,Food/Beverage/Tobacco,50170000,Seasonings/Preservatives/Extracts,50171500,Herbs/Spices/Extracts,10000049,Herbs/Spices (Shelf Stable),"DURKEE, PAPRIKA, SPANISH, 5LB",1,2016-09-14 11:58:51,2016-09-14 12:12:29,US,3wLX4j,DURKEE,C1D0BA35-0111-4FFE-94D5-49A56116BB6E,1.0,1.0,,3A283CD4-D9F7-4F8E-9C37-2C93AD17307E,"Durkee Spanish Paprika lends an appealing flavor to foods, as well as a beautiful red-to-orange color.  It also offers consistent flavor and color time after time to the foods it's used on.        Durkee Spices offer:        +  Clear packaging designed for easy and efficient use, with convenient       slip-guard side grips and a shake/pour cap        +  Easy-to-read, full bilingual labels (English and Spanish)        +  Complete nutritional panels on every product        +  Unique tamper evident packaging preserves flavor and keeps spices as fresh as the day they were packaged         +  Versatility and variety - from core spices and seasonings to value added    blends","Durkee Spanish Paprika lends an appealing flavor to foods, as well as a beautiful red-to-orange color.  It also offers consistent flavor and color time after time to the foods it's used on.",PAPRIKA,"Used often in Cajun and Mexican dishes. Mix with bread crumbs and batter mixes for a red visual appearance. Sprinkle on dry as a garnish to cottage cheese, mashed potatoes, deviled eggs or mix in foods where a red-to-orange color is desired.  Add a finishing touch to poultry, seafood or pasta dishes, especially alfredo.","Use dry or in foods to add a red to orange color and a mild, sweet flavor.  Commonly called the ""garnishing spice"".","This product is packaged in a clear recyclable bottle with a tamper proof seal. For best results, store tightly closed in a cool dry place.",730,EF622F49-397A-46CE-8FDA-90A0F14F57AD,00047600556407_A_1_C_1B_MFG%232004058.jpg,https://dam.catalog.1worldsync.com/im/dwn/1WS-641540,/images/ProductImages/ef622f49-397a-46ce-8fda-90a0f14f57ad.jpg,D0A123B5-9387-456C-B7E7-28B90AD33B1C,Paprika and Less Than 2% Silicon Dioxide Added To Prevent Caking .
E9429C34-5EFE-42EC-AB40-C458C840B007,51640E88-1D5D-4B65-AF55-D9527BFB6816,50000000,Food/Beverage/Tobacco,50170000,Seasonings/Preservatives/Extracts,50171500,Herbs/Spices/Extracts,10000050,Extracts/Salt/Meat Tenderisers (Shelf Stable),"DURKEE, IMITATION FLAVOR, VANILLA, CLEAR, 128FO",1,2016-03-28 16:51:15,2016-11-08 17:12:14,US,MvBsA7,DURKEE,88A45E49-325F-4E3B-9D9D-5CEB4B9AB523,,,,D99E7EDD-D6EA-4F97-8319-3320F3F62488,"This clear product is valued by bakers and pastry chefs. Since this product does not contain alcohol, it will not dissipate when used during baking or when added to hot liquids like pure vanilla extract does.        Durkee Extracts offer:        +  Clear packaging designed for easy and efficient use, with a convenient pour spout cap        +  Easy-to-read, full bilingual labels (English and Spanish)            +  Tamper evident foil-lined inner seal         +  Versatility and variety - in sizes and flavors","This clear product is valued by bakers and pastry chefs. Since this product does not contain alcohol, it will not dissipate when used during baking or when added to hot liquids like pure vanilla extract does.",IMITATION FLAVOR,"Ideal for white icings or desserts where no color is desired from pure or imitation vanilla extract.  Use for puddings, sauces, ice cream or cookies.  Flavor naturally enhances chocolate desserts.","Unlike pure vanilla extract, Durkee Imitation Clear Vanilla Flavor is very heat stable.  Since it will not dissipate, add at the beginning of the cooking or baking process. Substitute Durkee  Imitation Clear Vanilla Flavor for pure vanilla extract in light colored icings, baked goods and desserts.","Packaged in clear recyclable bottles with tamper proof seals.. For best results, store tightly closed in a cool dry place.",730,FDB45B37-1AEB-43B7-BE00-499832075FD1,00047600345018_A_1_C_1B_MFG%232003905.jpg,https://dam.catalog.1worldsync.com/im/dwn/1WS-641407,/images/ProductImages/fdb45b37-1aeb-43b7-be00-499832075fd1.jpg,1195F43C-00BD-46DD-901B-8DA3CF319230,"Water, Propylene Glycol, Vanillin, Ethyl Vanillin and Sodium Benzoate (preservative)."
