unqProductCategoryId,unqProductId,vchSegmentCode,vchSegmentDescription,vchFamilyCode,vchFamilyDescription,vchClassCode,vchClassDescription,intBrickCode,"vchBrickDescription""",vchProductName,bitConsumerUnit,datModified,datPublished,vchTargetMarket,vchReferenceId,vchBrandName,unqProductClaimId,bitGlutenFree,bitKosher,bitMsgFree,unqProductDescriptionId,vchProductDescription,vchAdditionalDescription,vchShortDescription,vchServingSuggestions,vchPreparation,vchStorage,intShelfLifeDays,unqProductImageId,vchFileName,vchOriginalUrl,vchLocalPath,unqProductIngredientId,vchIngredientStatement
211CDDA3-4366-4B0E-9D5D-3A532D88DECE,AB69ABF9-7102-4671-91E2-BDB6D7D47608,50000000,Food/Beverage/Tobacco,50170000,Seasonings/Preservatives/Extracts,50171500,Herbs/Spices/Extracts,10000049,Herbs/Spices (Shelf Stable),"DURKEE, POULTRY SEASONING, 10OZ",1,2016-09-14 11:44:49,2016-09-14 12:12:28,US,n92L22,DURKEE,401CCDAF-492C-410C-9FF7-38AF2B978CD1,1.0,1.0,,CE06BC85-C361-49B9-9930-C16654B7C06A,"This is a convenient, consistent and economical blend of spices that can be used in all types of poultry dishes.              Durkee Spices offer:        +  Clear packaging designed for easy and efficient use, with convenient       slip-guard side grips and a shake/pour cap        +  Easy-to-read, full bilingual labels (English and Spanish)        +  Complete nutritional panels on every product        +  Unique tamper evident packaging preserves flavor and keeps spices as fresh as the day they were packaged         +  Versatility and variety - from core spices and seasonings to value added    blends","This is a convenient, consistent and economical blend of spices that can be used in all types of poultry dishes.",POULTRY SEASONING,"Rub on chicken, turkey, veal, fish and pork before cooking. Great when added to hamburgers or meatloaf. Use in poultry gravies, casseroles and soups. When serving creamed chicken over biscuits, add 1 teaspoon or more to biscuit batter. Perfect for dressings and stuffings for turkey, chicken or wild fowl.","Start by using 1/8 tsp. per serving or 2 teaspoons for each 4 cups of stuffing.  To achieve its fullest flavor, add near the end of the cooking process.","This product is packaged in a clear recyclable bottle with a tamper proof seal. For best results, store tightly closed in a cool dry place.",730,FF0276BE-9222-47BC-947D-8CF20AA77F66,00047600547757_A_1_C_1B_MFG%232004013.jpg,https://dam.catalog.1worldsync.com/im/dwn/1WS-641497,/images/ProductImages/ff0276be-9222-47bc-947d-8cf20aa77f66.jpg,DC3AB669-C83B-4FF4-B71C-18C8930E56DB,Spices.
CC6D981E-A8C9-48B2-9AAC-3B57B51DFB8B,31075565-9C69-430C-9C22-ABB22B791736,50000000,Food/Beverage/Tobacco,50170000,Seasonings/Preservatives/Extracts,50171500,Herbs/Spices/Extracts,10000049,Herbs/Spices (Shelf Stable),"DURKEE, CELERY SEED, GROUND, 16OZ",1,2016-09-14 11:28:29,2016-09-14 12:12:27,US,OunGgl,DURKEE,4F7687B1-6B0D-4EE3-BAA3-F3FDBEF64589,1.0,1.0,,B87F01BC-4C37-4EF5-AA86-A5B43B79AAF8,"Durkee Ground Celery Seed is a versatile product that adds visual appeal as well as a strong celery flavor to foods. Durkee Spices offer:  Clear packaging designed for easy and efficient use, with convenient slip-guard side grips and a shake/pour cap. Easy-to-read, full bilingual labels (English and Spanish). Complete nutritional panels on every product. Unique tamper evident packaging preserves flavor and keeps spices as fresh as the day they were packaged. Versatility and variety - from core spices and seasonings to value added blends.",Durkee Ground Celery Seed is a versatile product that adds visual appeal as well as a strong celery flavor to foods.,CELERY SEED,"Use in salad dressings, tomato juice cocktail products, sausages, sauces, pickles, relishes and dips.  Delicious in salad dressings. Perfect for potato, pasta, chicken or tuna salad. Seasons stews, herb breads and vegetables. Try on poultry, beef, ham and seafood.","Use in moderation, as this product can give a bitter flavor when used in excess.","This product is packaged in a clear recyclable bottle with a tamper proof seal. For best results, store tightly closed in a cool dry place.",730,1DEA3996-579D-45AC-A907-84811F3CD33D,00047600541304_A_1_C_1B_MFG%232003962.jpg,https://dam.catalog.1worldsync.com/im/dwn/1WS-641450,/images/ProductImages/1dea3996-579d-45ac-a907-84811f3cd33d.jpg,C6097B52-9F25-4B1B-B47D-C3DAF6A30438,Celery Seed
492D32CB-7FA8-4271-8E4A-3BB4250A7247,6A743331-9398-4869-9476-CCE8A9B8CD73,50000000,Food/Beverage/Tobacco,50170000,Seasonings/Preservatives/Extracts,50171500,Herbs/Spices/Extracts,10000049,Herbs/Spices (Shelf Stable),"DURKEE, CILANTRO, 4OZ",1,2016-09-14 11:31:14,2016-09-14 12:12:27,US,hujad9,DURKEE,B1B67ADA-E03C-4AC3-9DBB-791F2C9E159D,1.0,1.0,,9FDF06A9-D3A6-4AF7-906E-EDC147CDFB95,"Most commonly used for Mexican or Southwestern dishes. Durkee Cilantro rehydrates very quickly and offer an easy and attractive way to add color to foods.   Durkee Cilantro offers cost savings over fresh cilantro; it requires no labor and there is no waste.        Durkee Spices offer:        +  Clear packaging designed for easy and efficient use, with convenient       slip-guard side grips and a shake/pour cap        +  Easy-to-read, full bilingual labels (English and Spanish)        +  Complete nutritional panels on every product        +  Unique tamper evident packaging preserves flavor and keeps spices as fresh as the day they were packaged        +  Versatility and variety - from core spices and seasonings to value added    blends",Most commonly used for Mexican or Southwestern dishes. Durkee Cilantro rehydrates very quickly and offer an easy and attractive way to add color to foods.   Durkee Cilantro offers cost savings over fresh cilantro; it requires no labor and there is no waste,CILANTRO,"Use in salsas, rice, dips, soups and sauces.  Delicious in any Mexican or Thai entree. Makes an attractive garnish for chicken, shrimp, pork or seafood.","Add Durkee Cilantro to foods after cooking is completed and just before serving to maintain optimum visual appeal.  When replacing fresh cilantro, use 1/3 as much.","This product is packaged in a clear recyclable bottle with a tamper proof seal. For best results, store tightly closed in a cool dry place.",730,E26A05B6-319B-47F0-8AD9-AF43CEC97468,00047600542271_A_1_C_1B_MFG%232003969.jpg,https://dam.catalog.1worldsync.com/im/dwn/1WS-641460,/images/ProductImages/e26a05b6-319b-47f0-8ad9-af43cec97468.jpg,04122DDC-6F8E-47FA-BBF7-040183C061D2,Cilantro
93A6748C-07FC-47E8-AD02-3C07D21C2431,213BE7FA-F182-40D2-AEBA-FDD6082B61F9,50000000,Food/Beverage/Tobacco,50170000,Seasonings/Preservatives/Extracts,50171500,Herbs/Spices/Extracts,10000049,Herbs/Spices (Shelf Stable),"DURKEE, MUSTARD SEED, GROUND, 25LB",1,2016-09-14 12:43:32,2016-09-14 13:12:57,US,08maZL,DURKEE,8C17E140-3305-4515-8AA4-2EFBAD738952,1.0,1.0,,AC43318F-25C3-42AF-B012-C3ECC5E37432,"Ground Mustard is easy and convenient to use.  The flavor of this mustard will blend well with other products, especially lemon juice and horseradish, making it a popular product to use for meat slurries, pastes and sauces.    Our Spices offer:    +  Clear packaging designed for easy and efficient use, with convenient slip-guard side grips and a shake/pour cap    +  Complete nutritional panels on every product    +  Unique tamper evident packaging preserves flavor and keeps spices as fresh as the day they were packaged    +  Versatility and variety - from core spices and seasonings to value added blends","Ground Mustard is easy and convenient to use.  The flavor of this mustard will blend well with other products, especially lemon juice and horseradish, making it a popular product to use for meat slurries, pastes and sauces.    O",MUSTARD SEED,"The primary use for this product is for making a mustard sauce or prepared mustard.  For strongest flavor, mix with cold water and let stand 10 - 30 minutes before using.  Use in white sauces, salad dressings, potato salad, BBQ sauces, chicken, pork, chili, eggs, coleslaw, deviled eggs and ham.  Add to honey for an easy honey-mustard sauce or glaze.","Add dry to foods or mix with liquid to use on foods.   If heated immediately after mixing with water or with an acid liquid such as vinegar, full pungency will not develop, as heat  and acid deactivates the enzyme reaction that causes the flavor.  Be sure to add to foods late and cook gently or the zesty, tangy flavor will fade.","This product is packaged in corrugate box with plastic liner. For best results, store tightly closed in a cool, dry place.",730,89EE2DFA-76E9-41B3-BEB2-C95A917D9644,00047600401288_A_1_C_1B_MFG%232006770.jpg,https://dam.catalog.1worldsync.com/im/dwn/1WS-641436,/images/ProductImages/89ee2dfa-76e9-41b3-beb2-c95a917d9644.jpg,85B2AB9C-3E3D-4677-B316-7821F7D3DDCC,Mustard Flour
54F714BE-CFB6-4B01-A05D-3C7D49A605FD,77E5AEE1-A51D-40D1-B9FF-B92FE5D3D46E,50000000,Food/Beverage/Tobacco,50170000,Seasonings/Preservatives/Extracts,50171500,Herbs/Spices/Extracts,10000049,Herbs/Spices (Shelf Stable),"DURKEE, RED BELL PEPPER, 33OZ",1,2016-09-14 13:52:59,2016-09-14 14:12:37,US,EL9kDV,DURKEE,143D6D9B-4E8F-4497-B215-346DC15615F7,1.0,1.0,,A313820D-857C-4FC6-9BE5-FFAF9A1AE1CC,"Durkee's Red Peppers over a convenient alternative to fresh peppers.  No time consuming seeding and chopping and no waste.    Durkee's Spices offer:    +  Clear packaging designed for easy and efficient use, with convenient slip-guard side grips and a shake/pour cap    +  Complete nutritional panels on every product    +  Unique tamper evident packaging preserves flavor and keeps spices as fresh as the day they were packaged    +  Versatility and variety - from core spices and seasonings to value added blends","Durkee's Red Peppers over a convenient alternative to fresh peppers.  No time consuming seeding and chopping and no waste.    Durkee's Spices offer:    +  Clear packaging designed for easy and efficient use, with convenient slip-guard side grips",RED BELL PEPPER,"Use in nearly any dish calling for fresh peppers.  Delicious in dips, soups, sauces or casseroles.  Rehydrate and add to eggs, hash browns, pizza or stir-frys.","Add to moist dishes or rehydrate.  To rehydrate, soak 1 part Durkee's Red Peppers to two parts water for 15 minutes.  Drain and use.          1 cup fresh chopped red pepper equals 1/2 cup Durkee's Red Peppers.","This product is packaged in a clear recyclable bottle with a tamper proof seal. For best results, store tightly closed in a cool dry place.",730,632AF062-9EB4-4DAA-905E-7A4B8B738832,D Bell Pepper Red Premium.jpg,https://dam.catalog.1worldsync.com/im/dwn/1WS-644330,/images/ProductImages/632af062-9eb4-4daa-905e-7a4b8b738832.jpg,ACAC82F1-F0C0-46F6-8217-E1AF22888A82,Dehydrated Red Bell Peppers. Contains sulfiting agents.
818205F3-D6B8-4BC5-8E7F-3D4FBD55EB3C,F68C8458-4C8B-4D9F-B7FB-CFB739AE4B7A,50000000,Food/Beverage/Tobacco,50170000,Seasonings/Preservatives/Extracts,50171500,Herbs/Spices/Extracts,10000049,Herbs/Spices (Shelf Stable),"DURKEE, ANCHO CITRUS SEASONING, 23OZ",1,2016-09-14 12:32:49,2016-09-14 13:12:56,US,qBdldA,DURKEE,1E3697ED-89B1-4537-955E-FE7E9273EACC,1.0,1.0,,5ED58C34-D04A-4ABC-A463-E9AAFA452526,"Durkee Ancho-Citrus Seasoning offers a consistent flavor profile with no messy spice blending and inaccuracies. This unique blend of spices and herbs will add new pizzazz to menus. Durkee Spices offer:  Clear packaging designed for easy and efficient use, with convenient slip-guard side grips and a shake/pour cap. Easy-to-read, full bilingual labels (English and Spanish). Complete nutritional panels on every product. Unique ttamper evident packaging preserves flavor and keeps spices as fresh as the day they were packaged. Versatility and variety - from core spices and seasonings to value added blends.",Durkee Ancho-Citrus Seasoning offers a consistent flavor profile with no messy spice blending and inaccuracies.  This unique blend of spices and herbs will add new pizzazz to menus.,ANCHO CITRUS SEASONING,"This unique Latin blend adds new flavors to seafood, poultry or pork.  Add Durkee Ancho-Citrus Seasoning to rice pilaf, marinades or salad dressings.  Delicious in soups, dips and sauces.",Use as a sprinkle on seasoning during cooking or add a Latin twist to favorite recipes.,"This product is packaged in a clear recyclable bottle with a tamper proof seal. For best results, store tightly closed in a cool dry place.",730,F86CEAA4-AE3C-4F69-9E48-0CA0CA9ED711,00047600594003_A_1_C_1B_MFG%232004247.jpg,https://dam.catalog.1worldsync.com/im/dwn/1WS-641660,/images/ProductImages/f86ceaa4-ae3c-4f69-9e48-0ca0ca9ed711.jpg,26A0C864-2E2F-421B-9694-5CE4A01D24AA,"Dehydrated Garlic, Salt, Spices, Paprika (as color), Orange Peel, AnchoChile Pepper, Citric Acid, Natural Flavor, Annatto Extractive (ascolor), Soy Lecithin."
464F6DE4-78F9-4403-8C25-3DBF2A415619,ED1684FB-790A-403C-9E35-8181F5279212,50000000,Food/Beverage/Tobacco,50170000,Seasonings/Preservatives/Extracts,50171500,Herbs/Spices/Extracts,10000049,Herbs/Spices (Shelf Stable),"DURKEE, WHITE PEPPER, GROUND, 25LB",1,2016-09-14 11:14:50,2016-09-14 12:12:26,US,9EtSiA,DURKEE,CE845887-799E-48C8-A22E-D417139DBF08,1.0,1.0,,763B8813-A4F6-4000-AE83-31AA7B55B0F1,"Durkee Ground White Pepper blends uniformly and colorlessly into foods. Use where the visual appearance of black pepper would be objectionable.        Durkee Spices offer:        +  Clear packaging designed for easy and efficient use, with convenient       slip-guard side grips and a shake/pour cap        +  Easy-to-read, full bilingual labels (English and Spanish)        +  Complete nutritional panels on every product        +  Unique tamper evident packaging preserves flavor and keeps spices as fresh as the day they were packaged        +  Versatility and variety - from core spices and seasonings to value added    blends",Durkee Ground White Pepper blends uniformly and colorlessly into foods. Use where the visual appearance of black pepper would be objectionable.,WHITE PEPPER,"Use when making white sauces, sausage gravy, fettuccini alfredo, dips, cream soups, egg dishes or any other light colored foods. Perfect for mayonnaise blends, egg noodles, rice or mashed potatoes.","Best used for cooking purposes; white pepper is not an appropriate table-top seasoning.  To get the most flavor from this pepper, add at the end of the cooking process.  Use a dash or two per serving.","This product is packaged in corrugate box with plastic liner. For best results, store tightly closed in a cool, dry place.",730,C5A9662B-5921-43D2-865E-47730F85F789,00047600400236_A_1_C_1B_MFG%232003922.jpg,https://dam.catalog.1worldsync.com/im/dwn/1WS-641420,/images/ProductImages/c5a9662b-5921-43d2-865e-47730f85f789.jpg,25414F28-678B-4589-8771-D0CC4BC81562,White pepper
44D36186-4B9D-4974-B2CE-3DC648D5D4C8,6AA3E6B4-F699-4A9E-B980-E32720AA066A,50000000,Food/Beverage/Tobacco,50170000,Seasonings/Preservatives/Extracts,50171500,Herbs/Spices/Extracts,10000049,Herbs/Spices (Shelf Stable),"DURKEE, SMOKED PAPRIKA, 25LB",1,2016-09-14 11:21:22,2016-09-14 12:12:30,US,2fKDfS,DURKEE,E89B6778-1970-47BA-B7F9-5B8E48F9EDBF,1.0,1.0,,7C208C9B-3931-4385-A7C7-36B404FE026E,"Durkee Spices offer:  Clear packaging designed for easy and efficient use, with convenient slip-guard side grips and a shake/pour cap.  Easy-to-read, full bilingual labels (English and Spanish).  Complete nutritional panels on every product.  Unique tamper evident packaging preserves flavor and keeps spices as fresh as the day they were packaged.  Versatility and variety - from core spices and seasonings to value added blends.","Durkee Smoked Paprika lends an appealing flavor to foods, as well as a beautiful deep red color.  It also offers a marvelous smoky flavor with consistent color time.",SMOKED PAPRIKA,"Durkee Smoked Paprika is essential in Spanish cooking.  Use in a traditional paella or romesco sauce.  Add dramatic smoky flavors to meat rubs, salad dressings or crumb toppings for potatoes or fish.  A few dashes of Durkee Smoked Paprika will add contemporary appeal and dramatic flavor to menu favorites like macaroni and cheese, sauteed green beans and grilled salmon.  Flavored butters, sour cream, mayonnaise or ranch dressing are transformed with a dash of Durkee Smoked Paprika.","Like other paprikas, Durkee Smoked Paprika is great for garnishing but it also provides bold flavor. Just a pinch of Durkee Smoked Paprika will give a rich smoky flavor to nearly any dish.  Use Durkee Smoked Paprika in vegetarian dishes to add a ""meaty flavor"" without adding savory meats like bacon, ham or sausage.","This product is packaged in a clear recyclable bottle with a tamper proof seal. For best results, store tightly closed in a cool dry place.",730,DB88115F-69AA-4C52-86CE-57DE3816C9B9,ACH Foodservice Bulk BX.jpg,https://dam.catalog.1worldsync.com/im/dwn/1WS-639965,/images/ProductImages/db88115f-69aa-4c52-86ce-57de3816c9b9.jpg,226EAE2A-B317-4A15-B452-889EA6E5CAD1,Paprika and Less Than 2% Silicon Dioxide Added To Prevent Caking .
44D36186-4B9D-4974-B2CE-3DC648D5D4C8,6AA3E6B4-F699-4A9E-B980-E32720AA066A,50000000,Food/Beverage/Tobacco,50170000,Seasonings/Preservatives/Extracts,50171500,Herbs/Spices/Extracts,10000049,Herbs/Spices (Shelf Stable),"DURKEE, SMOKED PAPRIKA, 25LB",1,2016-09-14 11:21:22,2016-09-14 12:12:30,US,2fKDfS,DURKEE,E89B6778-1970-47BA-B7F9-5B8E48F9EDBF,1.0,1.0,,7C208C9B-3931-4385-A7C7-36B404FE026E,"Durkee Spices offer:  Clear packaging designed for easy and efficient use, with convenient slip-guard side grips and a shake/pour cap.  Easy-to-read, full bilingual labels (English and Spanish).  Complete nutritional panels on every product.  Unique tamper evident packaging preserves flavor and keeps spices as fresh as the day they were packaged.  Versatility and variety - from core spices and seasonings to value added blends.","Durkee Smoked Paprika lends an appealing flavor to foods, as well as a beautiful deep red color.  It also offers a marvelous smoky flavor with consistent color time.",SMOKED PAPRIKA,"Durkee Smoked Paprika is essential in Spanish cooking.  Use in a traditional paella or romesco sauce.  Add dramatic smoky flavors to meat rubs, salad dressings or crumb toppings for potatoes or fish.  A few dashes of Durkee Smoked Paprika will add contemporary appeal and dramatic flavor to menu favorites like macaroni and cheese, sauteed green beans and grilled salmon.  Flavored butters, sour cream, mayonnaise or ranch dressing are transformed with a dash of Durkee Smoked Paprika.","Like other paprikas, Durkee Smoked Paprika is great for garnishing but it also provides bold flavor. Just a pinch of Durkee Smoked Paprika will give a rich smoky flavor to nearly any dish.  Use Durkee Smoked Paprika in vegetarian dishes to add a ""meaty flavor"" without adding savory meats like bacon, ham or sausage.","This product is packaged in a clear recyclable bottle with a tamper proof seal. For best results, store tightly closed in a cool dry place.",730,01DBA269-5DCC-4603-92E4-EC6264FCFECA,ACH Foodservice Bulk BX.jpg,https://dam.catalog.1worldsync.com/im/dwn/1WS-639965,/images/ProductImages/01dba269-5dcc-4603-92e4-ec6264fcfeca.jpg,226EAE2A-B317-4A15-B452-889EA6E5CAD1,Paprika and Less Than 2% Silicon Dioxide Added To Prevent Caking .
8EA0ED28-7A8C-4107-B7A8-3DF01CAB3EC1,E169DBF8-DAC3-4BD1-A884-DDE5BC9794DB,50000000,Food/Beverage/Tobacco,50170000,Seasonings/Preservatives/Extracts,50171500,Herbs/Spices/Extracts,10000049,Herbs/Spices (Shelf Stable),"DURKEE, SRIRACHA SEASONING, 25 LB",1,2016-09-14 13:55:25,2016-09-14 14:12:37,US,IB6u10,DURKEE,2808D0A2-F2BB-4E37-AC99-AF2ADD10A41C,,1.0,,7FB6264A-699B-4801-95E3-5E3ADBCA3A3A,Durkee Sriracha Seasoning features the popular Sriracha flavor to more applications.,The dry application allows operators to add the popular Sriracha flavor to more applications.,SRIRACHA SEASONING,"Durkee Sriracha seasoning gives a little kick to French fries, fried appetizers and vegetables. Try on proteins: grilled fish, chicken, steak and shrimp. Add a dash to macaroni and cheese, Alfredo sauces, scrambled eggs and breakfast casseroles. Mix into dips and sauces like hummus, ranch dressing, mayo, ketchup and sour cream. The possibilities are endless.",Durkee Sriracha Seasoning blend can be used when cooking or just after cooking to add color as well as flavor to your foods,"For best results, store tightly closed in a cool dry place.",730,567593E4-1626-420F-BE9A-2361EC754C9E,D Sriracha 25lb 2010735.png,https://dam.catalog.1worldsync.com/im/dwn/1WS-699009,/images/ProductImages/567593e4-1626-420f-be9a-2361ec754c9e.png,BA1845B1-26F2-4B9F-BC1D-8357D402A7B8,"Sugar, Dehydrated Garlic, Salt, Chili Pepper, Maltodextrin, Citric Acid,Red Pepper, Rice Concentrate, Paprika Extractives (color), NaturalFlavors, Vinegar."
F6A405A8-7F02-4544-9E08-3FBC98992389,4AA360F3-DF56-4EEA-886D-D3C351817F19,50000000,Food/Beverage/Tobacco,50170000,Seasonings/Preservatives/Extracts,50171500,Herbs/Spices/Extracts,10000049,Herbs/Spices (Shelf Stable),"DURKEE, PASTA SEASONING, 12OZ",1,2016-09-14 12:15:26,2016-09-14 13:12:56,US,9AUsAh,DURKEE,9FED9E61-0B74-46C5-A896-76CBA5BF0575,1.0,1.0,,0DAAE4D0-A5FA-4326-8C37-530C1BEEC82A,"Durkee Spices offer: Clear packaging designed for easy and efficient use, with convenient slip-guard side grips and a shake/pour cap. Complete nutritional panels on every product. Unique tamper evident packaging preserves flavor and keeps spices as fresh as the day they were packaged. Versatility and variety - from core spices and seasonings to value added blends.","Create a signature Italian pasta sauce by mixing one spice blend with tomato sauce. There's no need to buy 10 individual spices to get that true Italian flavor. You will save money due to reduction in labor, time & multiple ingredients.",PASTA SEASONING,"Use as a base for any Italian dish or any tomato based sauce or entrée- spaghetti and meatballs, lasagna or chicken Parmesan. Great as a sauce served on chicken cacciatore, chicken Marsala, veal, fish, meatloaf, hamburgers and pasta. Mix with olive oil and toss with pasta. Delicious in pasta salads or mixed with butter for a flavor-packed garlic bread.","For 1 quart sauce, mix 1/4 cup Pasta Seasoning with 30 oz. tomato sauce and 6 ounces tomato paste. Simmer for about 20 minutes.","This product is packaged in a clear recyclable bottle with a tamper proof seal. For best results, store tightly closed in a cool dry place.",730,A7436176-0E8D-4D51-A8D3-9E70F37F2509,D Pasta Seasoning Chef 2004142.png,https://dam.catalog.1worldsync.com/im/dwn/1WS-698995,/images/ProductImages/a7436176-0e8d-4d51-a8d3-9e70f37f2509.png,72F49AEF-33D1-433F-B767-68B3F815F7CF,"Dehydrated Onion, Salt, Spices, Dehydrated Green Bell Pepper, Parsley, Dehydrated Garlic."
129B8D36-921B-4ADF-A1AA-4192B0B19E29,25036EAD-32C6-4E7C-A3C8-84847C8AEA80,50000000,Food/Beverage/Tobacco,50170000,Seasonings/Preservatives/Extracts,50171800,Sauces/Spreads/Dips/Condiments,10000057,Sauces - Cooking (Shelf Stable),"DURKEE, SLOPPY JOE SEASONING, 28OZ",1,2016-12-09 15:08:44,2016-12-09 15:12:45,US,RYQ8vj,DURKEE,CCB6B0BE-A371-470A-A5E0-2BFE59AAEC2C,1.0,1.0,,6A2D4BA4-A875-454D-ADDA-FDAB014FDDE8,"Durkee Sloppy Joe Seasoning combines all the flavors you need to create delicious sloppy joes. No need for purchasing many different spices or time consuming measuring and spice blending. Durkee Spices offer: Clear packaging designed for easy and efficient use, with convenient slip-guard side grips and a shake/pour cap. Easy-to-read, full bilingual labels (English and Spanish). Complete nutritional panels on every product. Unique tamper evident packaging preserves flavor and keeps spices as fresh as the day they were packaged. Versatility and variety - from core spices and seasonings to value added blends.",Durkee Sloppy Joe Seasoning combines all the flavors you need to create delicious sloppy joes.  No need for purchasing many different spices or time consuming measuring and spice blending.,SLOPPY JOE SEASONING,"Prepare sloppy joes with ground beef, pork, turkey or chicken. Or try making with vegetarian soy crumbles.","To prepare delicious sloppy joes, brown 1 pound of ground beef. Drain fat and add 3 1/2 tablespoons Durkee Sloppy Joe Seasoning, 1 cup water, 1-6 oz. can tomato paste. Bring to a boil; simmer 10-15 minutes or until meat is thickened. Container will season 16 pounds of ground beef and make 3 gallons of sloppy joes.","This product is packaged in a clear recyclable bottle with a tamper proof seal. For best results, store tightly closed in a cool dry place.",730,E854D737-0427-49F6-AEA0-DE1FFA502519,00047600102185_A_1_C_1B_MFG%232003684.jpg,https://dam.catalog.1worldsync.com/im/dwn/1WS-641375,/images/ProductImages/e854d737-0427-49f6-aea0-de1ffa502519.jpg,6436DCE1-C17B-4E05-8455-0D07DB2947D4,"Sugar, Salt, Dehydrated Onion, Wheat Flour, Cornstarch, Garlic Powder,Spices, Worcestershire Sauce (Molasses, Vinegar, Corn Syrup, Salt,Caramel Color, Garlic, Sucrose, Spices, Tamarind, Natural Flavor), Caramel Color, Disodium Inosinate, Spice Extractive."
